{
  "schema_version": 1,
  "profile_id": "accounting-profile-otel-v1",
  "semantic_version": "1.0.0",
  "binding_id": "claude-code-otel-v1",
  "target_schema": "packages/schemas/normalized-event.schema.json",
  "specification": "docs/integrations/ADAPTER_ONE_CLAUDE_CODE_OTEL.md",
  "publication_rule": "This profile supports one metric. `claude_code.token.usage` is the only metric any fixture in this repository replays, so it is the only one named supported, and `gemini_cli.token.usage`, `gen_ai.client.token.usage` and `codex.turn.token_usage` are recorded as read surfaces with no capture rather than as planned or partial support. Nothing here is certification: `claude-code-otel-v1` is a candidate binding whose effective ceiling is private analytics, and a derivation table is a specification of a mechanism rather than evidence that any collector runs it.",
  "count_authority": "runtime-reported",
  "supported_metrics": [
    {
      "name": "claude_code.token.usage",
      "producer_id": "claude-code",
      "capture_vectors": "conformance/accounting/otel-capture-vectors-v1.json",
      "capture_evidence_kind": "exercised-on-hardware",
      "assessed_on": "2026-08-06",
      "note": "Eight vectors: five datapoint series covering the four type values, cumulative-to-delta, a counter decrease, a start-time change and two concurrent query_source series, and three refusals covering an identity attribute, an unknown attribute and an unmapped category value."
    }
  ],
  "unsupported_metrics": [
    {
      "name": "claude_code.cost.usage",
      "producer_id": "claude-code",
      "state": "discarded-server-owned",
      "reason": "A USD figure. Pricing is server-owned and a claim never carries a price, a currency or a cost estimate, so the receiver discards it before admission."
    },
    {
      "name": "claude_code.session.count",
      "producer_id": "claude-code",
      "state": "discarded-carries-no-token-fact",
      "reason": "Counts sessions rather than tokens. Nothing in the accounting arithmetic consumes it."
    },
    {
      "name": "claude_code.active_time.total",
      "producer_id": "claude-code",
      "state": "discarded-carries-no-token-fact",
      "reason": "A duration. Nothing in the accounting arithmetic consumes it."
    },
    {
      "name": "gemini_cli.token.usage",
      "producer_id": "gemini-cli",
      "state": "no-capture",
      "reason": "Read from a published configuration surface on 2026-08-06 and never exercised. No fixture in this repository replays a Gemini CLI export, so the type vocabulary, the instrument kind, the temporality and the reset behaviour are all unmeasured. Naming it supported would be a registry implying exercised support it does not have."
    },
    {
      "name": "gen_ai.client.token.usage",
      "producer_id": "gemini-cli",
      "state": "no-capture",
      "reason": "The OpenTelemetry GenAI semantic-convention metric the same CLI also emits. Emitting both means a naive receiver double counts, and no capture exists to decide which one the collector reads, so neither is consumed."
    },
    {
      "name": "codex.turn.token_usage",
      "producer_id": "codex-cli",
      "state": "no-capture",
      "reason": "Read from a published configuration surface on 2026-08-06 and never exercised. Two execution surfaces are additionally silent under openai/codex#12913, so even an exercised capture of the interactive surface would not cover the producer."
    }
  ],
  "capture_surface_hazards": [
    {
      "hazard_id": "claude-code-identity-attributes",
      "producer_id": "claude-code",
      "kind": "identity-attributes-on-every-datapoint",
      "default_state": "Every datapoint of every Claude Code metric carries `organization.id`, `user.account_uuid`, `user.account_id`, `user.email` and `user.id`. This is the default and no capture has ever been observed without them.",
      "receiver_obligation": "All five are stripped inside the receiver, on the decoded in-memory datapoint, before admission to the observation queue and therefore before any aggregation, counter-delta state or grouping. A stripped value never keys a structure, never reaches disk, a log or a crash report, and a datapoint from which one cannot be removed is rejected whole. There is no partial-clean path and no identity here is ever trusted for identity: the ranked identity comes from the account and the device lineage, never from a telemetry attribute.",
      "configuration_is_a_control": "partial",
      "attributes": [
        "organization.id",
        "user.account_id",
        "user.account_uuid",
        "user.email",
        "user.id"
      ],
      "reference": "D-099 fixes the strip list. OTEL_METRICS_INCLUDE_ACCOUNT_UUID=false removes the account UUIDs at the source and no documented setting removes user.email, which is why the removal is a receiver obligation and configuration is only a partial control."
    },
    {
      "hazard_id": "gemini-cli-log-prompts-default-on",
      "producer_id": "gemini-cli",
      "kind": "default-on-prompt-logging",
      "default_state": "Gemini CLI's `logPrompts` setting defaults to true, so prompt text is present on the telemetry logs channel unless the user explicitly disables it.",
      "receiver_obligation": "The collector never opens a logs channel for any producer. Ingesting it would import L0 content directly, and a receiver whose safety depended on a producer default being flipped would be relying on a setting it does not own. The metrics channel carries no prompt text and is the only admissible channel.",
      "configuration_is_a_control": "no",
      "reference": "docs/integrations/AGENT_INTEGRATION_RESEARCH_MATRIX.md, Gemini CLI row. The logs channel is unusable at any tier."
    },
    {
      "hazard_id": "codex-cli-statsig-exporter-default",
      "producer_id": "codex-cli",
      "kind": "default-third-party-metrics-exporter",
      "default_state": "Codex CLI's `[otel]` configuration block defaults `metrics_exporter` to `statsig`, not to `none`. Enabling telemetry without setting the exporter explicitly sends token metrics to a third party rather than to a local collector.",
      "receiver_obligation": "No instruction, document or installer in this product may tell a participant to enable Codex telemetry without pinning `metrics_exporter` to an OTLP exporter aimed at the loopback receiver. The collector cannot detect or prevent the third-party export, so the control is the instruction and the control is weak; this is a reason the producer stays uncaptured rather than a hazard that capture would mitigate.",
      "configuration_is_a_control": "yes",
      "reference": "Read from the published Codex CLI configuration surface on 2026-08-06 alongside openai/codex#12913. Recorded here and in docs/integrations/AGENT_INTEGRATION_RESEARCH_MATRIX.md; it was in neither before PF-041."
    }
  ],
  "known_contradictions": [
    {
      "contradiction_id": "otel-count-authority",
      "field": "count_authority",
      "this_profile": "runtime-reported",
      "other_authority": "conformance/accounting/accounting-profiles-v1.json",
      "other_value": "cloud-separate-cache-v1 declares every one of its four source fields provider-reported",
      "effect": "The same number is described twice with two different authorities, and provider-reported is the stronger evidence claim. The collector never sees a provider response: it sees a counter the CLI process emits, unsigned, and D-077 keeps every locally observed mechanism attested-local while D-100 records that no provider offers an individual-account attestation path. This profile writes runtime-reported, which is what docs/integrations/ADAPTER_ONE_CLAUDE_CODE_OTEL.md section 7 requires and what section 6 of the same document contradicts. Repairing it means registering a narrower accounting profile and re-pointing the binding, which changes the adapter's bound identity and is not this unit's to change.",
      "owner": "A-001"
    }
  ],
  "derivations": [
    {
      "field": "schema_version",
      "origin": "adapter-constant",
      "determinism": "deterministic",
      "rule": "The literal 1, from the target schema's const.",
      "constant": 1
    },
    {
      "field": "event_id",
      "origin": "collector-state",
      "determinism": "collector-minted",
      "rule": "A UUIDv7 the collector generates at normalization. OTLP carries no event identity, so two receivers of the same export mint two different values. The deterministic identity of the observation is local_fingerprint, not this."
    },
    {
      "field": "session_id",
      "origin": "otlp-attribute",
      "determinism": "device-scoped",
      "rule": "Derived inside the adapter process from the session.id attribute through the keyed local commitment the binding's transform disposition requires. The raw identifier is discarded when the datapoint leaves that process, and the key is device-local, so the value is stable on one device and unreproducible off it.",
      "otlp_attributes": [
        "session.id"
      ]
    },
    {
      "field": "parent_event_id",
      "origin": "not-derivable-from-otlp",
      "determinism": "not-observable",
      "rule": "Always null for this binding. query_source distinguishes main from subagent execution but names no parent, and the counter is aggregated per attribute set rather than per execution, so no linkage exists to read.",
      "constant": null
    },
    {
      "field": "adapter",
      "origin": "adapter-constant",
      "determinism": "deterministic",
      "rule": "adapter_id claude-code-otel with the artifact and manifest digests of the running adapter build. Deterministic for a given build and not a property of the payload."
    },
    {
      "field": "certification",
      "origin": "producer-binding",
      "determinism": "deterministic",